{
  "object": "bulk_data",
  "id": "27bf3214-1271-490b-bdfe-c0be6c23d02e",
  "type": "oracle_cards",
  "updated_at": "2026-05-29T09:00:00.000+00:00",
  "uri": "https://api.scryfall.com/bulk-data/27bf3214-1271-490b-bdfe-c0be6c23d02e",
  "name": "Oracle Cards",
  "description": "A JSON file containing one Scryfall card object for each Oracle ID on Scryfall. The chosen sets for the cards are an attempt to return the most up-to-date recognizable version of the card.",
  "compressed_size": 53345211,
  "download_uri": "https://data.scryfall.io/oracle-cards/oracle-cards-20260529090000.json",
  "content_type": "application/json",
  "content_encoding": "gzip",
  "size": 156234012
}
